[
  {
    "schemaVersion": 1,
    "taskId": "feature-foundation",
    "taskKind": "feature",
    "title": "Implement the prerequisite feature slice",
    "description": "Replace this example with the highest-priority independent feature.",
    "priority": 10,
    "dependsOn": [],
    "acceptanceCriteria": [
      "The requested behavior is implemented with focused tests.",
      "The worker worktree is clean and the implementation is committed."
    ],
    "baseRef": "main",
    "validationProfile": "p4fnv-full",
    "relevantPaths": [
      "src/",
      "src-tauri/src/"
    ],
    "metadata": {
      "issue": "replace-me"
    }
  },
  {
    "schemaVersion": 1,
    "taskId": "feature-dependent",
    "taskKind": "feature",
    "title": "Implement a dependent feature slice",
    "description": "This task becomes eligible only after feature-foundation is validated.",
    "priority": 20,
    "dependsOn": [
      "feature-foundation"
    ],
    "acceptanceCriteria": [
      "The dependent behavior is implemented and covered by focused tests.",
      "The full validation profile passes for the submitted commit."
    ],
    "baseRef": "main",
    "validationProfile": "p4fnv-full"
  }
]
